{
  "$schema": "http://json-schema.org/draft-07/schema#",
  "type": "object",
  "required": [
    "outputs",
    "artifacts",
    "signals",
    "summary"
  ],
  "properties": {
    "outputs": {
      "type": "object",
      "description": "Key-value pairs of step outputs."
    },
    "artifacts": {
      "type": "array",
      "items": {
        "type": "string"
      },
      "description": "List of artifact references produced in this step."
    },
    "signals": {
      "type": "array",
      "items": {
        "type": "string"
      },
      "description": "List of signal names emitted by the agent."
    },
    "summary": {
      "type": "string",
      "description": "Short human-readable summary of what was done."
    }
  },
  "additionalProperties": false
}