{
  "outputs": {
    "files_changed": [
      "src/types/index.ts",
      "src/db/index.ts",
      "src/db/queries.ts",
      "src/core/snapshot.ts",
      "src/cli/index.ts"
    ],
    "summary": "Implemented Issue #6: refactored Snapshot and Artifact models to make Artifact an independent first-class entity. Added Artifact interface and ArtifactRow type, workspace_artifacts database table, CRUD queries (insertArtifact, getArtifactById, listArtifactsByWorkspace, listArtifactsBySnapshot), updated snapshot creation to store metadata and diff content as Artifact rows, and added CLI artifact command with list and show subcommands supporting --json output. Build validated with npm run check (typecheck + build + smoke test all pass)."
  },
  "artifacts": [],
  "signals": [],
  "summary": "Implemented GitHub Issue #6: separated Artifact from Snapshot into independent first-class model. Changes span 5 files: types (new Artifact interface + ArtifactRow), DB schema (workspace_artifacts table), queries (4 CRUD functions), core snapshot logic (diffs stored as artifact rows), and CLI (artifact list/show commands with --json). npm run check passes cleanly."
}
