{
  "outputs": {
    "files_changed": [
      "src/types/index.ts",
      "src/db/index.ts",
      "src/db/queries.ts",
      "src/core/workspace.ts",
      "src/cli/index.ts"
    ],
    "summary": "Added workflowRunId, jobId, stepId, agentId optional execution context fields to Workspace entity across all layers: types (Workspace, WorkspaceRow, CreateWorkspaceInput, WorkspaceManifest), DB schema (4 new TEXT NULL columns with migration), queries (insertWorkspace), core (rowToWorkspace mapping, createWorkspace row/manifest), and CLI (--workflow-run-id, --job-id, --step-id, --agent-id create flags, formatWorkspace display, status/list JSON output). Typecheck, build, and smoke test all pass."
  },
  "artifacts": [],
  "signals": [],
  "summary": "Implemented GitHub Issue #4: Bound Workspace to Workflow Execution Context by adding optional workflowRunId, jobId, stepId, agentId fields to the Workspace model, DB schema, queries, core createWorkspace/manifest, and CLI create command. All layers updated consistently. npm run check passes (typecheck + build + smoke test)."
}
