{
  "outputs": {
    "task_summary": "Add a WorkspaceStatus state machine with 7 states (CREATED, PREPARING, READY, RUNNING, WAIT_REVIEW, MERGED, CLEANED), a transition validator enforcing legal state transitions, a transitionStatus() method that validates, updates DB, and records events, and expose status in all CLI inspect/list output. Introduce a WorkspaceStatus type in src/types/, update the Workspace interface, add transition logic in src/core/workspace.ts, and update DB schema default from 'created' to 'CREATED'.",
    "scope": "medium",
    "complexity_profile": "medium",
    "risk_notes": [
      "Status casing migration: task requires UPPERCASE states (CREATED, PREPARING, etc.) but existing code uses lowercase (created, prepared, locked, active, archived, failed). This is a breaking API/DB change. The task does not specify backward-compatibility or migration strategy.",
      "DB default value change: SQLite does not support ALTER COLUMN DEFAULT natively; changing the default from 'created' to 'CREATED' requires careful handling for existing rows that may retain old lowercase values.",
      "Existing status values differ from target: current states (created, prepared, locked, active, archived, cleaned, failed) must be replaced by new states (CREATED, PREPARING, READY, RUNNING, WAIT_REVIEW, MERGED, CLEANED). createWorkspace sets 'created'->'prepared'; under the new model these become 'CREATED'->'PREPARING'. bindRun sets 'active'; this maps to part of the RUNNING transition. cleanupWorkspace sets 'cleaned'; this maps to CLEANED. The 'locked', 'failed', and 'archived' states have no direct equivalent in the new model.",
      "No migration script or rollback plan specified in requirements. If existing databases contain workspaces with old status values, queries filtering by new status names may silently miss them."
    ]
  },
  "artifacts": [],
  "signals": [],
  "summary": "Intake analysis complete. The task is a medium-scope, medium-complexity change touching 4-5 source files across types, DB, core, and CLI layers. The primary risk is the status value renaming from lowercase to UPPERCASE, which is a breaking change to both the database schema and the JSON API contract. The implementation should clarify migration strategy before proceeding."
}
