{
  "outputs": {
    "task_summary": "Implement GitHub Issue #7 (sub-task 1): add YAML workspace definition schema (TypeScript interfaces), loader (js-yaml parser), validator (schema + constraint validation), and CLI `validate --definition <path>` command. Scope is limited to worktree type only. Introduces a new dependency: js-yaml (+ @types/js-yaml). Six files: src/types/definition.ts (interfaces), src/definition/loader.ts, src/definition/validator.ts, src/definition/index.ts (barrel), src/cli/index.ts (add validate command), plus two fixture YAML files.",
    "scope": "medium",
    "complexity_profile": {
      "new_files": 6,
      "modified_files": 1,
      "new_dependency": "js-yaml",
      "lines_estimate": "~250-350 total across all new files",
      "risk_areas": ["YAML parse error handling", "CLI integration with Commander.js"]
    }
  },
  "artifacts": [],
  "signals": [],
  "summary": "Intake analysis complete. Task is to implement YAML workspace definition support (Issue #7, sub-task 1). Scope is medium: 6 new files, 1 modified file, 1 new dependency (js-yaml). The implementation is well-bounded — TypeScript interfaces, a YAML loader, a validator, and a CLI command — with clear acceptance criteria (npm run check passes). No blocking issues detected."
}
